title,location
Data Analyst at ExampleCorp,Pune
Junior Data Scientist at ExampleCorp,Pune
Risk Analyst at ExampleCorp,Pune
Data Engineer at ExampleCorp,Pune
Financial Analyst at ExampleCorp,Pune
Business Analyst at ExampleCorp,Pune
Machine Learning Engineer at ExampleCorp,Pune
AI Engineer at ExampleCorp,Pune
Big Data Engineer at ExampleCorp,Pune
Data Science Intern at ExampleCorp,Pune
Research Analyst at ExampleCorp,Pune
Data Consultant at ExampleCorp,Pune
BI Developer at ExampleCorp,Pune
Data Visualization Specialist at ExampleCorp,Pune
Quantitative Analyst at ExampleCorp,Pune
Cloud Data Engineer at ExampleCorp,Pune
ETL Developer at ExampleCorp,Pune
NLP Engineer at ExampleCorp,Pune
Computer Vision Engineer at ExampleCorp,Pune
Compliance & Risk Analyst at ExampleCorp,Pune
Healthcare Data Analyst at ExampleCorp,Pune
Marketing Analyst at ExampleCorp,Pune
E-commerce Data Analyst at ExampleCorp,Pune
Supply Chain Analyst at ExampleCorp,Pune
Retail Data Analyst at ExampleCorp,Pune
Fraud Analyst at ExampleCorp,Pune
Telecom Data Analyst at ExampleCorp,Pune
Insurance Data Analyst at ExampleCorp,Pune
Junior Python Developer at ExampleCorp,Pune
Data Operations Associate at ExampleCorp,Pune
Analytics Trainee at ExampleCorp,Pune
Junior AI/ML Developer at ExampleCorp,Pune
Junior Business Intelligence Analyst at ExampleCorp,Pune
Junior Data Quality Analyst at ExampleCorp,Pune
Product Analyst at ExampleCorp,Pune
Client Data Analyst at ExampleCorp,Pune
Junior Data Integration Engineer at ExampleCorp,Pune
Model Validation Analyst at ExampleCorp,Pune
Forecasting Analyst at ExampleCorp,Pune
Deep Learning Engineer at ExampleCorp,Pune
Junior MLOps Engineer at ExampleCorp,Pune
Data Governance Analyst at ExampleCorp,Pune
Junior Quant Researcher at ExampleCorp,Pune
Data Compliance Intern at ExampleCorp,Pune
Statistical Analyst at ExampleCorp,Pune
Data Reporting Specialist at ExampleCorp,Pune
Decision Scientist at ExampleCorp,Pune
AI Research Intern at ExampleCorp,Pune
Junior Feature Engineer at ExampleCorp,Pune
Junior Cloud Analyst at ExampleCorp,Pune
Junior Data Strategist at ExampleCorp,Pune
Customer Insights Analyst at ExampleCorp,Pune
Revenue Analyst at ExampleCorp,Pune
Banking Data Analyst at ExampleCorp,Pune
Data Transformation Analyst at ExampleCorp,Pune
Junior Data Architect at ExampleCorp,Pune
Data Entry Analyst (Tech-enabled) at ExampleCorp,Pune
Open Source ML Contributor at ExampleCorp,Pune
SaaS Product Data Analyst at ExampleCorp,Pune
Junior DevOps for ML at ExampleCorp,Pune
Data Analyst at ExampleCorp,Mumbai
Junior Data Scientist at ExampleCorp,Mumbai
Risk Analyst at ExampleCorp,Mumbai
Data Engineer at ExampleCorp,Mumbai
Financial Analyst at ExampleCorp,Mumbai
Business Analyst at ExampleCorp,Mumbai
Machine Learning Engineer at ExampleCorp,Mumbai
AI Engineer at ExampleCorp,Mumbai
Big Data Engineer at ExampleCorp,Mumbai
Data Science Intern at ExampleCorp,Mumbai
Research Analyst at ExampleCorp,Mumbai
Data Consultant at ExampleCorp,Mumbai
BI Developer at ExampleCorp,Mumbai
Data Visualization Specialist at ExampleCorp,Mumbai
Quantitative Analyst at ExampleCorp,Mumbai
Cloud Data Engineer at ExampleCorp,Mumbai
ETL Developer at ExampleCorp,Mumbai
NLP Engineer at ExampleCorp,Mumbai
Computer Vision Engineer at ExampleCorp,Mumbai
Compliance & Risk Analyst at ExampleCorp,Mumbai
Healthcare Data Analyst at ExampleCorp,Mumbai
Marketing Analyst at ExampleCorp,Mumbai
E-commerce Data Analyst at ExampleCorp,Mumbai
Supply Chain Analyst at ExampleCorp,Mumbai
Retail Data Analyst at ExampleCorp,Mumbai
Fraud Analyst at ExampleCorp,Mumbai
Telecom Data Analyst at ExampleCorp,Mumbai
Insurance Data Analyst at ExampleCorp,Mumbai
Junior Python Developer at ExampleCorp,Mumbai
Data Operations Associate at ExampleCorp,Mumbai
Analytics Trainee at ExampleCorp,Mumbai
Junior AI/ML Developer at ExampleCorp,Mumbai
Junior Business Intelligence Analyst at ExampleCorp,Mumbai
Junior Data Quality Analyst at ExampleCorp,Mumbai
Product Analyst at ExampleCorp,Mumbai
Client Data Analyst at ExampleCorp,Mumbai
Junior Data Integration Engineer at ExampleCorp,Mumbai
Model Validation Analyst at ExampleCorp,Mumbai
Forecasting Analyst at ExampleCorp,Mumbai
Deep Learning Engineer at ExampleCorp,Mumbai
